{
  "cases": [
    {
      "case_id": "sc-coexist-0000",
      "current_truth": [
        {
          "fact_id": "f-a",
          "rationale": "independent fact, not updated by any later pair"
        },
        {
          "fact_id": "f-b",
          "rationale": "independent fact, coexists with f-a"
        }
      ],
      "facts": [
        {
          "content": "avoids gluten in their diet",
          "date": "2024-01-08T09:00:00Z",
          "fact_id": "f-a"
        },
        {
          "content": "enjoys ambient electronic music",
          "date": "2024-02-07T09:00:00Z",
          "fact_id": "f-b"
        }
      ],
      "pairs": [
        {
          "earlier_id": "f-a",
          "label": "coexist",
          "later_id": "f-b"
        }
      ]
    },
    {
      "case_id": "sc-coexist-0001",
      "current_truth": [
        {
          "fact_id": "f-a",
          "rationale": "independent fact, not updated by any later pair"
        },
        {
          "fact_id": "f-b",
          "rationale": "independent fact, coexists with f-a"
        }
      ],
      "facts": [
        {
          "content": "prefers window seats when traveling",
          "date": "2024-01-08T09:00:00Z",
          "fact_id": "f-a"
        },
        {
          "content": "keeps a succulent on their desk",
          "date": "2024-02-07T09:00:00Z",
          "fact_id": "f-b"
        }
      ],
      "pairs": [
        {
          "earlier_id": "f-a",
          "label": "coexist",
          "later_id": "f-b"
        }
      ]
    },
    {
      "case_id": "sc-coexist-0002",
      "current_truth": [
        {
          "fact_id": "f-a",
          "rationale": "independent fact, not updated by any later pair"
        },
        {
          "fact_id": "f-b",
          "rationale": "independent fact, coexists with f-a"
        }
      ],
      "facts": [
        {
          "content": "reads mostly historical fiction",
          "date": "2024-01-08T09:00:00Z",
          "fact_id": "f-a"
        },
        {
          "content": "plays badminton on weekends",
          "date": "2024-02-07T09:00:00Z",
          "fact_id": "f-b"
        }
      ],
      "pairs": [
        {
          "earlier_id": "f-a",
          "label": "coexist",
          "later_id": "f-b"
        }
      ]
    },
    {
      "case_id": "sc-coexist-0003",
      "current_truth": [
        {
          "fact_id": "f-a",
          "rationale": "independent fact, not updated by any later pair"
        },
        {
          "fact_id": "f-b",
          "rationale": "independent fact, coexists with f-a"
        }
      ],
      "facts": [
        {
          "content": "dislikes spicy food",
          "date": "2024-01-08T09:00:00Z",
          "fact_id": "f-a"
        },
        {
          "content": "collects vintage postage stamps",
          "date": "2024-02-07T09:00:00Z",
          "fact_id": "f-b"
        }
      ],
      "pairs": [
        {
          "earlier_id": "f-a",
          "label": "coexist",
          "later_id": "f-b"
        }
      ]
    },
    {
      "case_id": "sc-coexist-0004",
      "current_truth": [
        {
          "fact_id": "f-a",
          "rationale": "independent fact, not updated by any later pair"
        },
        {
          "fact_id": "f-b",
          "rationale": "independent fact, coexists with f-a"
        }
      ],
      "facts": [
        {
          "content": "works a hybrid schedule",
          "date": "2024-01-08T09:00:00Z",
          "fact_id": "f-a"
        },
        {
          "content": "volunteers at a community garden monthly",
          "date": "2024-02-07T09:00:00Z",
          "fact_id": "f-b"
        }
      ],
      "pairs": [
        {
          "earlier_id": "f-a",
          "label": "coexist",
          "later_id": "f-b"
        }
      ]
    },
    {
      "case_id": "sc-coexist-0005",
      "current_truth": [
        {
          "fact_id": "f-a",
          "rationale": "independent fact, not updated by any later pair"
        },
        {
          "fact_id": "f-b",
          "rationale": "independent fact, coexists with f-a"
        }
      ],
      "facts": [
        {
          "content": "uses a standing desk",
          "date": "2024-01-08T09:00:00Z",
          "fact_id": "f-a"
        },
        {
          "content": "subscribes to a weekly astronomy newsletter",
          "date": "2024-02-07T09:00:00Z",
          "fact_id": "f-b"
        }
      ],
      "pairs": [
        {
          "earlier_id": "f-a",
          "label": "coexist",
          "later_id": "f-b"
        }
      ]
    },
    {
      "case_id": "sc-coexist-0006",
      "current_truth": [
        {
          "fact_id": "f-a",
          "rationale": "independent fact, not updated by any later pair"
        },
        {
          "fact_id": "f-b",
          "rationale": "independent fact, coexists with f-a"
        }
      ],
      "facts": [
        {
          "content": "prefers tea over coffee in the evening",
          "date": "2024-01-08T09:00:00Z",
          "fact_id": "f-a"
        },
        {
          "content": "practices calligraphy as a hobby",
          "date": "2024-02-07T09:00:00Z",
          "fact_id": "f-b"
        }
      ],
      "pairs": [
        {
          "earlier_id": "f-a",
          "label": "coexist",
          "later_id": "f-b"
        }
      ]
    },
    {
      "case_id": "sc-coexist-0007",
      "current_truth": [
        {
          "fact_id": "f-a",
          "rationale": "independent fact, not updated by any later pair"
        },
        {
          "fact_id": "f-b",
          "rationale": "independent fact, coexists with f-a"
        }
      ],
      "facts": [
        {
          "content": "keeps a bullet journal",
          "date": "2024-01-08T09:00:00Z",
          "fact_id": "f-a"
        },
        {
          "content": "follows a strict Tuesday gym routine",
          "date": "2024-02-07T09:00:00Z",
          "fact_id": "f-b"
        }
      ],
      "pairs": [
        {
          "earlier_id": "f-a",
          "label": "coexist",
          "later_id": "f-b"
        }
      ]
    },
    {
      "case_id": "sc-coexist-0008",
      "current_truth": [
        {
          "fact_id": "f-a",
          "rationale": "independent fact, not updated by any later pair"
        },
        {
          "fact_id": "f-b",
          "rationale": "independent fact, coexists with f-a"
        }
      ],
      "facts": [
        {
          "content": "is left-handed",
          "date": "2024-01-08T09:00:00Z",
          "fact_id": "f-a"
        },
        {
          "content": "enjoys documentary films",
          "date": "2024-02-07T09:00:00Z",
          "fact_id": "f-b"
        }
      ],
      "pairs": [
        {
          "earlier_id": "f-a",
          "label": "coexist",
          "later_id": "f-b"
        }
      ]
    },
    {
      "case_id": "sc-coexist-0009",
      "current_truth": [
        {
          "fact_id": "f-a",
          "rationale": "independent fact, not updated by any later pair"
        },
        {
          "fact_id": "f-b",
          "rationale": "independent fact, coexists with f-a"
        }
      ],
      "facts": [
        {
          "content": "has two houseplants named after constellations",
          "date": "2024-01-08T09:00:00Z",
          "fact_id": "f-a"
        },
        {
          "content": "bikes to the farmers market on Saturdays",
          "date": "2024-02-07T09:00:00Z",
          "fact_id": "f-b"
        }
      ],
      "pairs": [
        {
          "earlier_id": "f-a",
          "label": "coexist",
          "later_id": "f-b"
        }
      ]
    },
    {
      "case_id": "sc-coexisttrap-0000-home_city_trap",
      "current_truth": [
        {
          "fact_id": "f-later",
          "rationale": "same home_city_trap slot as f-earlier despite independent phrasing; later wins"
        }
      ],
      "facts": [
        {
          "content": "lives in Rivertown",
          "date": "2024-01-08T09:00:00Z",
          "fact_id": "f-earlier"
        },
        {
          "content": "has recently settled into life in Lakeside",
          "date": "2024-05-22T09:00:00Z",
          "fact_id": "f-later"
        }
      ],
      "pairs": [
        {
          "earlier_id": "f-earlier",
          "label": "supersede",
          "later_id": "f-later"
        }
      ]
    },
    {
      "case_id": "sc-coexisttrap-0001-employer_trap",
      "current_truth": [
        {
          "fact_id": "f-later",
          "rationale": "same employer_trap slot as f-earlier despite independent phrasing; later wins"
        }
      ],
      "facts": [
        {
          "content": "works at Northwind Traders",
          "date": "2024-01-08T09:00:00Z",
          "fact_id": "f-earlier"
        },
        {
          "content": "has recently started a new role at Contoso Labs",
          "date": "2024-05-22T09:00:00Z",
          "fact_id": "f-later"
        }
      ],
      "pairs": [
        {
          "earlier_id": "f-earlier",
          "label": "supersede",
          "later_id": "f-later"
        }
      ]
    },
    {
      "case_id": "sc-multi-0000",
      "current_truth": [
        {
          "fact_id": "f2",
          "rationale": "supersedes f1 on the same slot"
        },
        {
          "fact_id": "f3",
          "rationale": "independent fact, no supersede pair involves it as the earlier side of a same-slot update"
        },
        {
          "fact_id": "f4",
          "rationale": "independent fact, unrelated to every other fact in this case"
        }
      ],
      "facts": [
        {
          "content": "carries a Solstice X12",
          "date": "2024-01-08T09:00:00Z",
          "fact_id": "f1"
        },
        {
          "content": "upgraded to a Solstice X14",
          "date": "2024-04-07T09:00:00Z",
          "fact_id": "f2"
        },
        {
          "content": "practices calligraphy as a hobby",
          "date": "2024-01-18T09:00:00Z",